{
  "$schema": "../schema/evidence-ledger-v1.schema.json",
  "ledger_schema_version": 1,
  "last_searched_on": "2026-08-02",
  "search_protocol": "../wiki/research/literature-search-method.md",
  "scope": "Wearable IMU behavior measurement, synchronized annotation, welfare governance, and relevant open hardware for indoor stall-fed goats and sheep.",
  "limitations": [
    "This is a reproducible scoped evidence map, not a completed PRISMA systematic review or meta-analysis.",
    "Scopus and Web of Science subscription searches were not available in the 2026-08-01 pass.",
    "Transfer records cannot establish accuracy for the project's species, indoor setting, placement, device, or endpoint."
  ],
  "records": [
    {
      "id": "mauny-pipeline-2025",
      "title": "A pipeline with pre-processing options to detect behaviour from accelerometer data using Machine Learning tested on dairy goats",
      "authors": ["Sarah Mauny", "Joon Kwon", "Nicolas C. Friggens", "Christine Duvaux-Ponter", "Masoomeh Taghipoor"],
      "year": 2025,
      "source_type": "PRIMARY_STUDY",
      "doi": "10.24072/pcjournal.545",
      "url": "https://doi.org/10.24072/pcjournal.545",
      "accessed_on": "2026-08-01",
      "license": "CC-BY-4.0",
      "directness": "DIRECT_INDOOR_GOAT",
      "species": ["GOAT"],
      "setting": "Eight indoor Alpine dairy goats",
      "sensor_mount": "Ear-mounted triaxial accelerometer at 5 Hz",
      "sample_size": "8 animals",
      "labels_or_endpoints": ["rumination", "head in feeder", "lying", "standing"],
      "validation_split": "Includes goats absent from training; exact experiment variants must be preserved when comparing metrics",
      "result_summary": "One human coded synchronized video in The Observer XT 16; four CatBoost binary classifiers learned engineered accelerometer-window features rather than video pixels. Tuned AUC values of 0.800-0.829 fell to 0.644-0.749 on goats absent from training.",
      "limitations": ["Small cohort", "Single human observer", "No video-AI validation", "Accelerometer only", "Ear placement and study conditions may not transfer to neck or another enclosure"],
      "use_in_project": "Closest direct methodological anchor for animal-held-out indoor-goat behavior modeling.",
      "status": "INCLUDED_DIRECT",
      "verified_source": "PUBLISHER"
    },
    {
      "id": "mauny-data-paper-2025",
      "title": "Data paper: A goat behaviour dataset combining labelled behaviours and accelerometer data for training Machine Learning detection models",
      "authors": ["Sarah Mauny", "Joon Kwon", "Nicolas C. Friggens", "Christine Duvaux-Ponter", "Masoomeh Taghipoor"],
      "year": 2025,
      "source_type": "DATA_PAPER",
      "doi": "10.1016/j.anopes.2025.100095",
      "url": "https://www.sciencedirect.com/science/article/pii/S2772694025000044",
      "accessed_on": "2026-08-01",
      "license": "CC-BY-NC-ND-4.0",
      "directness": "DIRECT_INDOOR_GOAT",
      "species": ["GOAT"],
      "setting": "Eight indoor dairy Alpine goats, 24 h sensor capture and two annotated daylight periods",
      "sensor_mount": "Ear-tag triaxial accelerometer at 5 Hz with synchronized video",
      "sample_size": "8 animals; 11 annotated hours per animal",
      "labels_or_endpoints": ["rumination", "head in feeder", "lying", "standing", "social behaviors"],
      "validation_split": "Dataset description; downstream split must be performed by animal",
      "result_summary": "Documents the direct indoor-goat data provenance behind the ACT4Behav work: overhead video was manually coded by one human in The Observer XT 16 and aligned to 5 Hz ear-accelerometer timestamps.",
      "limitations": ["Single trained human observer", "No independent-rater agreement", "No video-AI model", "Small cohort", "No gyroscope"],
      "use_in_project": "Dataset provenance, annotation design comparison, and directness classification.",
      "status": "INCLUDED_DIRECT",
      "verified_source": "PUBLISHER"
    },
    {
      "id": "mauny-dataset-2024",
      "title": "Accelerometers and annotated video recordings of behaviours: a dataset for training behaviour classification models in goats",
      "authors": ["Sarah Mauny", "Joon Kwon", "Nicolas C. Friggens", "Christine Duvaux-Ponter", "Masoomeh Taghipoor"],
      "year": 2024,
      "source_type": "DATASET",
      "doi": "10.57745/LGZBM1",
      "url": "https://doi.org/10.57745/LGZBM1",
      "accessed_on": "2026-08-01",
      "license": "Etalab-2.0",
      "directness": "DIRECT_INDOOR_GOAT",
      "species": ["GOAT"],
      "setting": "Indoor dairy-goat dataset corresponding to the Mauny data paper",
      "sensor_mount": "Ear-tag triaxial accelerometer at 5 Hz",
      "sample_size": "8 animals",
      "labels_or_endpoints": ["rumination", "head in feeder", "lying", "standing"],
      "validation_split": "Not imposed by the dataset; project benchmarking must group by animal",
      "result_summary": "Public raw accelerometer and associated behavior data with repository file-level checksums.",
      "limitations": ["Single observer", "No gyroscope", "Imported schema differs from Goat Sensor Lab"],
      "use_in_project": "Reproducible external benchmark after explicit schema mapping and license recording.",
      "status": "INCLUDED_DIRECT",
      "verified_source": "DATA_REPOSITORY"
    },
    {
      "id": "mendez-reyes-2025",
      "title": "Development of goat behaviour prediction with accelerometer data: a machine learning and pre-processing approach",
      "authors": ["Daniel Alexander Mendez-Reyes", "Blanca Fajardo-Viloria", "Sergi Sanjuan-Silvestre", "J. M. Calabuig", "Roger Arnau", "Arantxa Villagra", "Salvador Calvet", "Fernando Estelles"],
      "year": 2025,
      "source_type": "PRIMARY_STUDY",
      "doi": "10.1016/j.compag.2025.110701",
      "url": "https://riunet.upv.es/entities/publication/9a009bfa-6597-402f-ae2b-57d020858c6a",
      "accessed_on": "2026-08-01",
      "license": "UNKNOWN",
      "directness": "DIRECT_INDOOR_GOAT",
      "species": ["GOAT"],
      "setting": "Intensive indoor goat production environment",
      "sensor_mount": "Neck-mounted LIS3DH triaxial accelerometer at 10 Hz",
      "sample_size": "15 animals",
      "labels_or_endpoints": ["eating", "walking", "inactive"],
      "validation_split": "Animal-independent evaluation discussed; preserve the paper's exact split when reproducing",
      "result_summary": "Shows indoor neck-accelerometer feasibility and warns that preprocessing and train/test choices can inflate metrics.",
      "limitations": ["Different IMU and rate", "Accelerometer only", "Imported labels do not match this ethogram exactly"],
      "use_in_project": "Direct neck-placement evidence and a leakage-control reference.",
      "status": "INCLUDED_DIRECT",
      "verified_source": "INSTITUTIONAL_REPOSITORY"
    },
    {
      "id": "morgan-davies-review-2024",
      "title": "Review: Exploring the use of precision livestock farming for small ruminant welfare management",
      "authors": ["Claire Morgan-Davies", "Germain Tesniere", "Jean-Marc Gautier", "Grete H. M. Jorgensen", "Eliel Gonzalez-Garcia", "Cathy M. Dwyer", "and coauthors"],
      "year": 2024,
      "source_type": "REVIEW",
      "doi": "10.1016/j.animal.2024.101233",
      "url": "https://doi.org/10.1016/j.animal.2024.101233",
      "accessed_on": "2026-08-01",
      "license": "CC-BY-NC-ND-4.0",
      "directness": "SYNTHESIS",
      "species": ["GOAT", "SHEEP"],
      "setting": "Small-ruminant welfare across intensive and extensive systems",
      "sensor_mount": "Multiple PLF technologies",
      "sample_size": "Review and multi-country stakeholder workshops; not a sensor-validation cohort",
      "labels_or_endpoints": ["small-ruminant welfare indicators", "technology readiness", "risk alerts"],
      "validation_split": "Not applicable",
      "result_summary": "Maps many welfare concerns against limited technology readiness and supports risk-management alerts rather than diagnostic claims.",
      "limitations": ["Synthesis rather than validation of this device", "Heterogeneous systems and technologies"],
      "use_in_project": "Primary welfare-claim framing and readiness boundary.",
      "status": "INCLUDED_SYNTHESIS",
      "verified_source": "PUBLISHER"
    },
    {
      "id": "wang-sheep-review-2025",
      "title": "Non-invasive monitoring for precision sheep farming: Development, challenges, and future perspectives",
      "authors": ["Yanchao Wang", "Xiaoshuai Wang", "Kai Liu", "Kaixuan Cuan", "Zhixin Hua", "Kui Li", "Kaiying Wang"],
      "year": 2025,
      "source_type": "REVIEW",
      "doi": "10.1016/j.compag.2025.110050",
      "url": "https://www.sciencedirect.com/science/article/pii/S0168169925001565",
      "accessed_on": "2026-08-01",
      "license": "UNKNOWN",
      "directness": "SYNTHESIS",
      "species": ["SHEEP"],
      "setting": "Precision sheep farming across production environments",
      "sensor_mount": "Wearable, adhesive, weighing, and visual monitoring technologies",
      "sample_size": "Review; not a sensor-validation cohort",
      "labels_or_endpoints": ["behavior", "health and welfare monitoring", "technology challenges"],
      "validation_split": "Not applicable",
      "result_summary": "Current synthesis of non-invasive sheep monitoring technologies and adoption challenges.",
      "limitations": ["Review rather than direct validation", "Sheep-only and heterogeneous settings"],
      "use_in_project": "Current sheep technology landscape and gap identification.",
      "status": "INCLUDED_SYNTHESIS",
      "verified_source": "PUBLISHER"
    },
    {
      "id": "cabra-2026",
      "title": "Application of a Lightweight, Open-Hardware Wearable System for Robust Behaviour Monitoring in Precision Livestock Farming",
      "authors": ["Jesus A. Baro", "Jose A. Bodero", "and coauthors"],
      "year": 2026,
      "source_type": "PRIMARY_STUDY",